{
  "schema_version": 1,
  "name": "starling-fidelity-corpus",
  "provenance_policy": "Every fixture is synthetic: expected content and reference outputs were authored by hand, and audio synthesis parameters describe sine/noise segments used only as transport and stitch evidence. No real, consented or licensed human speech is included; adding such audio is a tracked future gap and must come with its own consent record. Nothing here is ASR-quality evidence.",
  "fixtures": [
    {
      "id": "fx-resume-01",
      "category": "resumed-numbering",
      "languages": [
        "en"
      ],
      "duration_seconds": 16.0,
      "provenance": "synthetic",
      "synthesis": {
        "sample_rate": 16000,
        "segments": [
          {
            "kind": "speech",
            "duration_seconds": 6.0
          },
          {
            "kind": "silence",
            "duration_seconds": 2.0
          },
          {
            "kind": "speech",
            "duration_seconds": 6.0
          },
          {
            "kind": "silence",
            "duration_seconds": 2.0
          }
        ]
      },
      "expected": {
        "capture": {
          "speech_regions": [
            [
              0.0,
              6.0
            ],
            [
              8.0,
              14.0
            ]
          ],
          "silence_regions": [
            [
              6.0,
              8.0
            ],
            [
              14.0,
              16.0
            ]
          ]
        },
        "asr": {
          "critical_tokens": [
            "oat",
            "milk",
            "eggs",
            "stop"
          ],
          "numeric_values": [
            "5",
            "6",
            "7"
          ],
          "list_continuation": {
            "prior_index": 4,
            "markers": [
              "5",
              "6",
              "7"
            ]
          }
        },
        "authored": {
          "critical_tokens": [
            "oat",
            "milk",
            "eggs",
            "stop"
          ],
          "list_continuation": {
            "prior_index": 4,
            "markers": [
              "5",
              "6",
              "7"
            ]
          }
        },
        "delivered": {
          "critical_tokens": [
            "oat",
            "milk",
            "eggs",
            "stop"
          ],
          "final_phrases": [
            [
              "7",
              "stop",
              "there"
            ]
          ],
          "superseded_phrases": [
            [
              "4",
              "stop",
              "there"
            ]
          ]
        }
      },
      "reference_outputs": {
        "capture": {
          "segments": [
            [
              0.0,
              6.0
            ],
            [
              8.0,
              14.0
            ]
          ]
        },
        "asr": {
          "tokens": [
            "5",
            "buy",
            "oat",
            "milk",
            "6",
            "buy",
            "eggs",
            "7",
            "stop",
            "there"
          ]
        },
        "authored": {
          "tokens": [
            "5",
            "buy",
            "oat",
            "milk",
            "6",
            "buy",
            "eggs",
            "7",
            "stop",
            "there"
          ]
        },
        "delivered": {
          "tokens": [
            "5",
            "buy",
            "oat",
            "milk",
            "6",
            "buy",
            "eggs",
            "7",
            "stop",
            "there"
          ]
        }
      },
      "stages": {
        "capture_completeness": {
          "min_speech_region_coverage": 0.99
        },
        "asr_content": {
          "min_critical_token_recall": 1.0,
          "min_entity_accuracy": 1.0,
          "min_numeric_accuracy": 1.0
        },
        "authored_intent": {
          "min_critical_token_recall": 1.0
        },
        "delivered_text": {
          "min_critical_token_recall": 1.0,
          "require_no_duplicates": true,
          "require_fresh_revision": true
        }
      }
    },
    {
      "id": "fx-tech-01",
      "category": "technical-terms",
      "languages": [
        "en"
      ],
      "duration_seconds": 12.0,
      "provenance": "synthetic",
      "synthesis": {
        "sample_rate": 16000,
        "segments": [
          {
            "kind": "speech",
            "duration_seconds": 4.0
          },
          {
            "kind": "silence",
            "duration_seconds": 1.0
          },
          {
            "kind": "speech",
            "duration_seconds": 4.0
          },
          {
            "kind": "silence",
            "duration_seconds": 1.0
          },
          {
            "kind": "speech",
            "duration_seconds": 2.0
          }
        ]
      },
      "expected": {
        "capture": {
          "speech_regions": [
            [
              0.0,
              4.0
            ],
            [
              5.0,
              9.0
            ],
            [
              10.0,
              12.0
            ]
          ],
          "silence_regions": [
            [
              4.0,
              5.0
            ],
            [
              9.0,
              10.0
            ]
          ]
        },
        "asr": {
          "critical_tokens": [
            "ingress",
            "acceleration",
            "kubernetes",
            "traefik",
            "webgpu"
          ],
          "entities": [
            "kubernetes",
            "traefik",
            "webgpu"
          ]
        },
        "authored": {
          "critical_tokens": [
            "ingress",
            "acceleration",
            "kubernetes",
            "traefik",
            "webgpu"
          ],
          "entities": [
            "kubernetes",
            "traefik",
            "webgpu"
          ]
        },
        "delivered": {
          "critical_tokens": [
            "ingress",
            "acceleration",
            "kubernetes",
            "traefik",
            "webgpu"
          ]
        }
      },
      "reference_outputs": {
        "capture": {
          "segments": [
            [
              0.0,
              4.0
            ],
            [
              5.0,
              9.0
            ],
            [
              10.0,
              12.0
            ]
          ]
        },
        "asr": {
          "tokens": [
            "the",
            "deployment",
            "runs",
            "on",
            "kubernetes",
            "the",
            "ingress",
            "uses",
            "traefik",
            "and",
            "webgpu",
            "acceleration"
          ]
        },
        "authored": {
          "tokens": [
            "the",
            "deployment",
            "runs",
            "on",
            "kubernetes",
            "and",
            "the",
            "ingress",
            "uses",
            "traefik",
            "with",
            "webgpu",
            "acceleration"
          ]
        },
        "delivered": {
          "tokens": [
            "the",
            "deployment",
            "runs",
            "on",
            "kubernetes",
            "and",
            "the",
            "ingress",
            "uses",
            "traefik",
            "with",
            "webgpu",
            "acceleration"
          ]
        }
      },
      "stages": {
        "capture_completeness": {
          "min_speech_region_coverage": 0.99
        },
        "asr_content": {
          "min_critical_token_recall": 1.0,
          "min_entity_accuracy": 1.0,
          "min_numeric_accuracy": 1.0
        },
        "authored_intent": {
          "min_critical_token_recall": 1.0
        },
        "delivered_text": {
          "min_critical_token_recall": 1.0,
          "require_no_duplicates": true,
          "require_fresh_revision": true
        }
      }
    },
    {
      "id": "fx-selfcor-01",
      "category": "self-correction",
      "languages": [
        "en"
      ],
      "duration_seconds": 12.0,
      "provenance": "synthetic",
      "synthesis": {
        "sample_rate": 16000,
        "segments": [
          {
            "kind": "speech",
            "duration_seconds": 6.0
          },
          {
            "kind": "silence",
            "duration_seconds": 1.0
          },
          {
            "kind": "speech",
            "duration_seconds": 5.0
          }
        ]
      },
      "expected": {
        "capture": {
          "speech_regions": [
            [
              0.0,
              6.0
            ],
            [
              7.0,
              12.0
            ]
          ],
          "silence_regions": [
            [
              6.0,
              7.0
            ]
          ]
        },
        "asr": {
          "critical_tokens": [
            "deploy",
            "friday",
            "monday",
            "saturday"
          ]
        },
        "authored": {
          "critical_tokens": [
            "deploy",
            "monday",
            "standup",
            "saturday"
          ],
          "corrections": [
            {
              "mode": "replacement",
              "retracted": [
                "deploy",
                "on",
                "friday"
              ],
              "final": [
                "deploy",
                "on",
                "monday"
              ]
            },
            {
              "mode": "disjunction",
              "alternatives": [
                "friday",
                "saturday"
              ]
            }
          ]
        },
        "delivered": {
          "critical_tokens": [
            "deploy",
            "monday",
            "standup",
            "saturday"
          ]
        }
      },
      "reference_outputs": {